{"expected_schema_digests":[{"schema_id":"gocode.rc0.schema.artifact-inventory/3","sha256":"8610f9a620631f31ce3029ec8e9b7676674849cae63a5298ea426aba31f2a8f1"},{"schema_id":"gocode.rc0.schema.candidate-record/3","sha256":"63333aea4cc1357d7e9d25bcc6368b2fe651ee3d92c0804864df50f2fe5715c4"},{"schema_id":"gocode.rc0.schema.checksums-text/3","sha256":"cbd8c767ea275236ae08d043b426c93b9f10665602e28a565b60a48160d5eb8d"},{"schema_id":"gocode.rc0.schema.documentation-validation/3","sha256":"815ad8317e8e13097aa24d43d09ef87a87bae97524f9f83f07430207bda4cc86"},{"schema_id":"gocode.rc0.schema.fail-closed-disposition/3","sha256":"833bb432fafa1609261d15f766e800b7bb158ae904d871e9fa17cc94d1408224"},{"schema_id":"gocode.rc0.schema.qualification-policy-bundle/3","sha256":"4a44b28b633c350768d5960f8b480a9764d4b0781b01a255063dd3e08f1e4951"},{"schema_id":"gocode.rc0.schema.sbom-spdx-2.3/3","sha256":"fa9a83873c2282ab5b1af53bd84b67d1fdba21d87f191c7cff19a16bca2dfc25"},{"schema_id":"gocode.rc0.schema.security-validation/3","sha256":"3d706f42ab8e917496e9d2ac6b99f07b6a48f6acc138e072664ef03f7d20baaa"},{"schema_id":"gocode.rc0.schema.source-gate-results/3","sha256":"3c43e824462dfb23afe3c8e961e1e64dd004c19b98f92efbd29eaa0fe52963a8"},{"schema_id":"gocode.rc0.schema.test-inventory/3","sha256":"d12a1461ce732546b68b8b60d7e0513973ae113c002fd8f71008873c6ee89fb5"},{"schema_id":"gocode.rc0.schema.verification-report/3","sha256":"af24c4be574feffb0f575ffdf87e08b9176cf69e32904c2413bbaffc98b1c858"}],"expires_at":"2026-08-09T02:00:00.000000Z","freshness_policy":{"clock_skew_seconds":30,"maximum_age_seconds":3600},"issued_at":"2026-08-09T00:00:00.000000Z","issuer_id":"fixture-operator","key_id":"fixture-key-1","not_before":"2026-08-09T00:00:00.000000Z","policy_digest":"cccccccccccccccccccccccccccccccccccccccccccccccccccccccccccccccc","policy_revision":3,"profile":"gocode.rc0.evidence-profile/3","repository_id":"gocode","required_gates":[{"exit_semantics":"ZERO_ONLY","expected_counts":{"executed":1,"ignored":0,"passed":1},"gate_id":"fixture-source-test","identity_profile_bindings":["repository_id","candidate_source_sha","evidence_attempt_id","observed_evidence_revision","evidence_bundle_digest","policy_revision","policy_digest","profile","exact_artifact_bindings"],"required":true,"selectors":["fixture::test"],"signal_semantics":"ANY_SIGNAL_BLOCKS","stage":"SOURCE_CANDIDATE","timeout_seconds":30,"toolchain":"fixture-only","verification_mode":"DIRECT_RUN"},{"exit_semantics":"ZERO_ONLY","expected_counts":{"executed":1,"ignored":0,"passed":1},"gate_id":"fixture-production-test","identity_profile_bindings":["repository_id","candidate_source_sha","evidence_attempt_id","observed_evidence_revision","evidence_bundle_digest","policy_revision","policy_digest","profile","exact_artifact_bindings"],"required":true,"selectors":["fixture::production-test"],"signal_semantics":"ANY_SIGNAL_BLOCKS","stage":"PRODUCTION_QUALIFICATION","timeout_seconds":30,"toolchain":"fixture-only","verification_mode":"DIRECT_RUN"}],"runner_contract":{"dependency_inventory_digest":"dddddddddddddddddddddddddddddddddddddddddddddddddddddddddddddddd","executable_digest":"eeeeeeeeeeeeeeeeeeeeeeeeeeeeeeeeeeeeeeeeeeeeeeeeeeeeeeeeeeeeeeee","runner_class":"external-fixture-placeholder"},"schema_id":"gocode.rc0.schema.qualification-policy-bundle/3","signature":"fixture-only-not-a-signature","trusted_evidence_issuers":["fixture-evidence-issuer"],"workflow_policy_digests":["ffffffffffffffffffffffffffffffffffffffffffffffffffffffffffffffff"]}
